### ISSUE TITLE
tacacsgui not sending logs to syslog server

### ISSUE THREAD

**Issue by fleung1** [tacacsgui/tacacsgui#101]
VMWare Appliance
Ubuntu version: 18.04.2 LTS 
PHP version: 7.3.8-1
TacacsGUI API version: 0.9.77
Browser: chrome

Logs are not sending to my Syslog server.

I verified from the tacgui server syslog server ip and port is accessible and opened 

 ###MANUAL CONFIGURATION END###
  accounting log = accounting_log
  authentication log = authentication_log
  authorization log = authorization_log
  ###Syslog Settings###
  authentication log = 10.169.254.16:514
  authorization log = 10.169.254.16:514
  accounting log = 10.169.254.16:514
  connection timeout = 600
  context timeout = 3600
  password max-attempts = 1
  password backoff = 1
  separation tag = "*"
  skip conflicting groups = yes
  skip missing groups = yes

Thank you for your help.

**Comment by gurkin33** [comment]
Hello,

Could you please check existence of traffic on interface with tcpdump?
sudo tcpdump -i ens192 port 514
If you can see any traffic, then it is network issue.

**Comment by fleung1** [comment]
Hi,
I see traffic going out. I will double check the network. Thanks!

tacgui@tacgui:~$ sudo tcpdump -i ens160 host 10.169.254.86 and port 514
tcpdump: verbose output suppressed, use -v or -vv for full protocol decode
listening on ens160, link-type EN10MB (Ethernet), capture size 262144 bytes
12:30:32.642121 IP tacgui.54008 > syslog.lab-b.lab.syslog: SYSLOG uucp.info, length: 163
12:30:46.440924 IP tacgui.54008 > syslog.lab-b.lab.syslog: SYSLOG uucp.info, length: 94
12:30:58.737608 IP tacgui.54008 > syslog.lab-b.lab.syslog: SYSLOG uucp.info, length: 164
12:31:03.483385 IP tacgui.54008 > syslog.lab-b.lab.syslog: SYSLOG uucp.info, length: 93
12:31:06.733255 IP tacgui.54008 > syslog.lab-b.lab.syslog: SYSLOG uucp.info, length: 178
12:31:12.291598 IP tacgui.54008 > syslog.lab-b.lab.syslog: SYSLOG uucp.info, length: 181
12:37:59.388037 IP tacgui.54008 > syslog.lab-b.lab.syslog: SYSLOG uucp.info, length: 178
12:38:10.800629 IP tacgui.54008 > syslog.lab-b.lab.syslog: SYSLOG uucp.info, length: 181
12:52:54.060821 IP tacgui.54008 > syslog.lab-b.lab.syslog: SYSLOG uucp.info, length: 163
12:53:14.421110 IP tacgui.54008 > syslog.lab-b.lab.syslog: SYSLOG uucp.info, length: 90
12:53:19.476241 IP tacgui.54008 > syslog.lab-b.lab.syslog: SYSLOG uucp.info, length: 90
12:53:29.150227 IP tacgui.54008 > syslog.lab-b.lab.syslog: SYSLOG uucp.info, length: 90
12:53:32.319111 IP tacgui.54008 > syslog.lab-b.lab.syslog: SYSLOG uucp.info, length: 90
12:53:35.720935 IP tacgui.54008 > syslog.lab-b.lab.syslog: SYSLOG uucp.info, length: 90
